,Title,Author,Link,Price,Rating,Rating Count
337,"My First 1000 Words: Early Learning Picture Book to Learn Alphabet, Numbers, Shapes and Colours, Transport, Birds and Animals, Professions, Opposite ... Parts of the body and Objects Around Us.",Wonder House Books,https://amazon.in/First-1000-Words-Transport-Professions/dp/9388144112/ref=sr_1_248?keywords=Books&qid=1649704941&sr=8-248,159,4.5 out of 5 stars,"5,519"
338,Brilliant Brain Activity Book 4+,Dreamland Publications,https://amazon.in/Brilliant-Brain-Activity-Book-4/dp/9389281024/ref=sr_1_249?keywords=Books&qid=1649704941&sr=8-249,150,4.6 out of 5 stars,"2,584"
339,इंग्रजी व्याकरण व शब्द संग्रह (English grammar by Sachin Jadhavar),unknown,https://amazon.in/%E0%A4%87%E0%A4%82%E0%A4%97%E0%A5%8D%E0%A4%B0%E0%A4%9C%E0%A5%80-%E0%A4%B5%E0%A5%8D%E0%A4%AF%E0%A4%BE%E0%A4%95%E0%A4%B0%E0%A4%A3-English-grammar-Jadhavar/dp/8194938325/ref=sr_1_250?keywords=Books&qid=1649704941&sr=8-250,unkown,unknown,unknown
340,My Father: The Extraordinary Life of an Ordinary Man,Arvind Panagariya,https://amazon.in/gp/slredirect/picassoRedirect.html/ref=pa_sp_mtf_aps_sr_pg16_1?ie=UTF8&adId=A05914531X60QR2KL0NNZ&url=%2FMy-Father-Extraordinary-Life-Ordinary%2Fdp%2F9354222854%2Fref%3Dsr_1_251_sspa%3Fkeywords%3DBooks%26qid%3D1649704941%26sr%3D8-251-spons%26psc%3D1&qualifier=1649704941&id=3178367048818285&widgetName=sp_mtf,230,3.8 out of 5 stars,4
341,My First Pop-Up Fairy Tales - Beauty And The Beast : Pop up Books for children,unknown,https://amazon.in/gp/slredirect/picassoRedirect.html/ref=pa_sp_mtf_aps_sr_pg16_1?ie=UTF8&adId=A02185631I8J95QHUDVEE&url=%2FMy-First-Pop-Up-Fairy-Tales%2Fdp%2F935440006X%2Fref%3Dsr_1_252_sspa%3Fkeywords%3DBooks%26qid%3D1649704941%26sr%3D8-252-spons%26psc%3D1&qualifier=1649704941&id=3178367048818285&widgetName=sp_mtf,unkown,unknown,unknown
342,"Writing Books for Kids (Set of 4 Books) - Pattern Writing, Numbers 1-20, Alphabet Capital Letters, Small Letters",unknown,https://amazon.in/Writing-Books-Kids-Set-Alphabet/dp/9391924344/ref=sr_1_253?keywords=Books&qid=1649704941&sr=8-253,unkown,unknown,unknown
343,The Book Of Dog,Hemali Sodhi,https://amazon.in/Book-Dog-Hemali-Sodhi/dp/9354893562/ref=sr_1_254?keywords=Books&qid=1649704941&sr=8-254,489,4.9 out of 5 stars,29
344,"Meri Pratham Hindi Sulekh Boxset: Four Hindi Workbooks to Practice Words And Sentences (Shabd Gyan, Maatra Gyan, Sayukt Akshar Gyan, Vaakya Gyan)",Wonder House Books,https://amazon.in/Meri-Pratham-Hindi-Sulekh-Boxset/dp/9388810554/ref=sr_1_255?keywords=Books&qid=1649704941&sr=8-255,239,4.4 out of 5 stars,"1,086"
345,Shirt Ka Teesra Button । शर्ट का तीसरा बटन,Manav Kaul,https://amazon.in/Shirt-Teesra-Button-%E0%A4%B6%E0%A4%B0%E0%A5%8D%E0%A4%9F-%E0%A4%A4%E0%A5%80%E0%A4%B8%E0%A4%B0%E0%A4%BE/dp/9392820321/ref=sr_1_256?keywords=Books&qid=1649704941&sr=8-256,218.45,5.0 out of 5 stars,9
346,It's In His Kiss: Bridgerton (Bridgertons Book 7),Julia Quinn,https://amazon.in/Its-His-Kiss-Epilogue-Bridgertons-ebook/dp/B00UG8RP6S/ref=sr_1_257?keywords=Books&qid=1649704941&sr=8-257,294.04,4.6 out of 5 stars,"10,562"
347,"Flags of the World - Sticker Coloring Activity Book For Children : Continent, Country, Capital, Language and Currency",Wonder House Books,https://amazon.in/Flags-World-Coloring-Activity-Continent/dp/9390391601/ref=sr_1_258?keywords=Books&qid=1649704941&sr=8-258,194,4.5 out of 5 stars,263
348,"365 Facts on Space Book for Children Age 7-15 years, 80 Pages",Dreamland Publications,https://amazon.in/365-Facts-Space-Dreamland-Publications/dp/9388371755/ref=sr_1_259?keywords=Books&qid=1649704941&sr=8-259,204,4.5 out of 5 stars,"1,265"
349,Riches Are Your Right,Hardcover,https://amazon.in/Riches-Your-Right-Joseph-Murphy/dp/938905379X/ref=sr_1_260?keywords=Books&qid=1649704941&sr=8-260,79,4.3 out of 5 stars,206
350,Early Learning Padded Book of Opposites : Padded Board Books For Children,unknown,https://amazon.in/gp/slredirect/picassoRedirect.html/ref=pa_sp_btf_aps_sr_pg16_1?ie=UTF8&adId=A00819133EN0VJE3GDBZ3&url=%2FEarly-Learning-Padded-Book-Opposites%2Fdp%2F9354402968%2Fref%3Dsr_1_261_sspa%3Fkeywords%3DBooks%26qid%3D1649704941%26sr%3D8-261-spons%26psc%3D1&qualifier=1649704941&id=3178367048818285&widgetName=sp_btf,unkown,unknown,unknown
351,The Golem South Asian Edition: What You Should Know about Science (Canto),unknown,https://amazon.in/gp/slredirect/picassoRedirect.html/ref=pa_sp_btf_aps_sr_pg16_1?ie=UTF8&adId=A0083646223PSVTHJCO2D&url=%2FGolem-South-Asian-Should-Science%2Fdp%2F0521120373%2Fref%3Dsr_1_262_sspa%3Fkeywords%3DBooks%26qid%3D1649704941%26sr%3D8-262-spons%26psc%3D1%26smid%3DA15DBATYR506U3&qualifier=1649704941&id=3178367048818285&widgetName=sp_btf,unkown,unknown,unknown
352,Common Stocks and Uncommon Profits and Other Writings (Wiley Investment Classics),Philip A. Fisher,https://amazon.in/gp/slredirect/picassoRedirect.html/ref=pa_sp_atf_next_aps_sr_pg17_1?ie=UTF8&adId=A02298151HKLX0Q7F8X83&url=%2FUncommon-Profits-Writings-Investment-Classics-ebook%2Fdp%2FB00XCC5Y0O%2Fref%3Dsr_1_257_sspa%3Fkeywords%3DBooks%26qid%3D1649704945%26sr%3D8-257-spons%26psc%3D1&qualifier=1649704945&id=2997931921297933&widgetName=sp_atf_next,371.7,4.2 out of 5 stars,"1,344"
353,GMAT Official Guide 2022: Book + Online Question Bank,unknown,https://amazon.in/gp/slredirect/picassoRedirect.html/ref=pa_sp_atf_next_aps_sr_pg17_1?ie=UTF8&adId=A06457202SCYF5K3TNTYX&url=%2FGMAT-Official-Guide-2022-Question-ebook%2Fdp%2FB09NMTBKK1%2Fref%3Dsr_1_258_sspa%3Fkeywords%3DBooks%26qid%3D1649704945%26sr%3D8-258-spons%26psc%3D1&qualifier=1649704945&id=2997931921297933&widgetName=sp_atf_next,unkown,unknown,unknown
354,"Little Colouring Books for Kids (Set of 10 Books) - Gift to children for painting, drawing and colouring - Alphabets, Animals, Birds, Flags, Flowers, ... Transport, Vegetables - 3 to 6 years old",Maple Press,https://amazon.in/Colouring-Books-Set-10/dp/9350332167/ref=sr_1_259?keywords=Books&qid=1649704945&sr=8-259,205,4.3 out of 5 stars,"1,028"
355,"My Little Book of Ganesha: Illustrated board books on Hindu mythology, Indian gods & goddesses for kids age 3+; A Puffin Original.",unknown,https://amazon.in/Little-Book-Ganesha-Illustrated-mythology/dp/0143453262/ref=sr_1_260?keywords=Books&qid=1649704945&sr=8-260,unkown,unknown,unknown
356,Creative Coloring Mandala For Kids,Wonder House Books,https://amazon.in/Creative-Coloring-Mandala-Wonder-House/dp/9389178096/ref=sr_1_261?keywords=Books&qid=1649704945&sr=8-261,79,4.6 out of 5 stars,526
357,My First Padded Board Books of Times Table: Multiplication Tables From 1 - 20,unknown,https://amazon.in/First-Padded-Board-Books-Times/dp/9388144244/ref=sr_1_262?keywords=Books&qid=1649704945&sr=8-262,unkown,unknown,unknown
358,"MHT CET Triumph Maths Book for Engineering and Pharmacy Entrance Exam | Based on relevant chapters of 11th and 12th Syllabus of Maharashtra Board | Includes Formulae, Shortcuts, Chapterwise MCQs",unknown,https://amazon.in/Engineering-Pharmacy-Maharashtra-Shortcuts-Chapterwise/dp/B08HGW34GJ/ref=sr_1_263?keywords=Books&qid=1649704945&sr=8-263,unkown,unknown,unknown
359,Tnpsc Group IV (4) & VAO Exam Book Based on School New and Old Text Books (New Scheme and Syllabus) (Tamil),unknown,https://amazon.in/Tnpsc-Group-Exam-Book-Tamil/dp/B08F5FMMNV/ref=sr_1_264?keywords=Books&qid=1649704945&sr=8-264,unkown,unknown,unknown
360,The Art of Bitfulness: Keeping Calm in the Digital World | Penguin Non-fiction & Self Help Books,Nandan Nilekani,https://amazon.in/Art-Bitfulness-Keeping-Digital-Non-fiction/dp/067009479X/ref=sr_1_265?keywords=Books&qid=1649704945&sr=8-265,548,4.6 out of 5 stars,74
361,The Illustrated Stories Of Tenali Raman: Classic Tales From India,Wonder House Books,https://amazon.in/Illustrated-Stories-Tenali-Raman-Classic/dp/938956784X/ref=sr_1_266?keywords=Books&qid=1649704945&sr=8-266,169,4.6 out of 5 stars,"1,378"
362,A Goofy Fairy Tale,Disney,https://amazon.in/gp/slredirect/picassoRedirect.html/ref=pa_sp_mtf_aps_sr_pg17_1?ie=UTF8&adId=A061042433MDXEU3JFOB7&url=%2FGoofy-Fairy-Tale-Disney%2Fdp%2F0143440349%2Fref%3Dsr_1_267_sspa%3Fkeywords%3DBooks%26qid%3D1649704945%26sr%3D8-267-spons%26psc%3D1%26smid%3DA3H3WE9M6NY1KV&qualifier=1649704945&id=2997931921297933&widgetName=sp_mtf,188,4.4 out of 5 stars,3
363,Trading Price Action Trends: Technical Analysis of Price Charts Bar by Bar for the Serious Trader (Wiley Trading Book 540),Al Brooks,https://amazon.in/gp/slredirect/picassoRedirect.html/ref=pa_sp_mtf_aps_sr_pg17_1?ie=UTF8&adId=A1003766CS0GXKE0D40V&url=%2FTrading-Price-Action-Trends-Technical-ebook%2Fdp%2FB0067PZ87C%2Fref%3Dsr_1_268_sspa%3Fkeywords%3DBooks%26qid%3D1649704945%26sr%3D8-268-spons%26psc%3D1&qualifier=1649704945&id=2997931921297933&widgetName=sp_mtf,"3,387",4.4 out of 5 stars,297
364,"Assam Year Book 2022 ""Jyoti Prakashan""",unknown,https://amazon.in/Assam-Year-Book-Jyoti-Prakashan/dp/B09N7CJ1KJ/ref=sr_1_269?keywords=Books&qid=1649704945&sr=8-269,unkown,unknown,unknown
365,My Baby Record Book,unknown,https://amazon.in/Baby-Record-Book-Dreamland-Publications/dp/9350896540/ref=sr_1_270?keywords=Books&qid=1649704945&sr=8-270,unkown,unknown,unknown
366,"The Magic of the Lost Temple: Illustrated, easy to read and much-loved first full length children’s fiction novel by Sudha Murty for ages 8–12: ... fiction novel by Sudha Murty for ages 8–12",unknown,https://amazon.in/Magic-Lost-Temple-Sudha-Murty/dp/014333316X/ref=sr_1_271?keywords=Books&qid=1649704945&sr=8-271,unkown,unknown,unknown
367,Death; An Inside Story: A book for all those who shall die,Sadhguru,https://amazon.in/Death-Inside-Story-those-shall/dp/0143450832/ref=sr_1_272?keywords=Books&qid=1649704945&sr=8-272,171,4.7 out of 5 stars,"8,956"
368,"Children's Encyclopedia - Scientists, Inventions And Discoveries: The World of Knowledge",unknown,https://amazon.in/Childrens-Encyclopedia-Scientists-Discoveries-Familiarises/dp/9350570394/ref=sr_1_273?keywords=Books&qid=1649704945&sr=8-273,unkown,unknown,unknown
369,Beth the Baby Boat Goes to School (A Children's Picture Book) (BETTA LA BARCHETTA - BETH THE BABY BOAT - CLÉO LE PETIT BATEAU),Silvano Martina,https://amazon.in/Beth-Baby-School-Childrens-Picture-ebook/dp/B00QDUJXJA/ref=sr_1_274?keywords=Books&qid=1649704945&sr=8-274,0,5.0 out of 5 stars,1
370,NCERT Science for Class 9 - with binding 2021,unknown,https://amazon.in/NCERT-Science-Class-binding-2021/dp/B09LDDHYRX/ref=sr_1_275?keywords=Books&qid=1649704945&sr=8-275,unkown,unknown,unknown
371,"Sank Magic Practice Copybook, (4 BOOK + 10 REFILL ) Number Tracing Book for Preschoolers with Pen, Magic Calligraphy Copybook Set Practical Reusable Writing Tool Simply Hand Lettering",unknown,https://amazon.in/Practice-Preschoolers-Calligraphy-Practical-Lettering/dp/B09RQ1B7VW/ref=sr_1_276?keywords=Books&qid=1649704945&sr=8-276,unkown,unknown,unknown
372,Design and Equipment for Restaurants and Foodservice: A Management View,Costas Katsigris,https://amazon.in/gp/slredirect/picassoRedirect.html/ref=pa_sp_btf_aps_sr_pg17_1?ie=UTF8&adId=A01370241194D7ZPTHZX&url=%2FDesign-Equipment-Restaurants-Foodservice-Management%2Fdp%2F0471762482%2Fref%3Dsr_1_277_sspa%3Fkeywords%3DBooks%26qid%3D1649704945%26sr%3D8-277-spons%26psc%3D1%26smid%3DA1VZCGPIC1TQIP&qualifier=1649704945&id=2997931921297933&widgetName=sp_btf,"5,545",4.5 out of 5 stars,16
373,What’s Within You : Your Roadmap to Living Life With No Barriers,unknown,https://amazon.in/gp/slredirect/picassoRedirect.html/ref=pa_sp_btf_aps_sr_pg17_1?ie=UTF8&adId=A09828151LOD3ZS73RANI&url=%2FWhats-Within-You-Roadmap-Barriers%2Fdp%2F935440409X%2Fref%3Dsr_1_278_sspa%3Fkeywords%3DBooks%26qid%3D1649704945%26sr%3D8-278-spons%26psc%3D1&qualifier=1649704945&id=2997931921297933&widgetName=sp_btf,unkown,unknown,unknown
374,Common Stocks and Uncommon Profits and Other Writings: 40 (Wiley Investment Classics),Philip A. Fisher,https://amazon.in/gp/slredirect/picassoRedirect.html/ref=pa_sp_atf_next_aps_sr_pg18_1?ie=UTF8&adId=A01698113R3OVJEXBFYKR&url=%2FUncommon-Profits-Writings-Investment-Classics%2Fdp%2F0471445509%2Fref%3Dsr_1_273_sspa%3Fkeywords%3DBooks%26qid%3D1649704948%26sr%3D8-273-spons%26psc%3D1&qualifier=1649704948&id=6685964609233241&widgetName=sp_atf_next,849,4.2 out of 5 stars,"1,344"
375,CFO Handbook: An essential guide,unknown,https://amazon.in/gp/slredirect/picassoRedirect.html/ref=pa_sp_atf_next_aps_sr_pg18_1?ie=UTF8&adId=A018073124LHKPELZRGY&url=%2FCFO-Handbook-essential-guide-Chatterjee%2Fdp%2F9354353053%2Fref%3Dsr_1_274_sspa%3Fkeywords%3DBooks%26qid%3D1649704948%26sr%3D8-274-spons%26psc%3D1&qualifier=1649704948&id=6685964609233241&widgetName=sp_atf_next,unkown,unknown,unknown
376,My First Numbers Sticker Book: Exciting Sticker Book With 100 Stickers,Wonder House Books,https://amazon.in/My-First-Numbers-Sticker-Book/dp/9388144961/ref=sr_1_275?keywords=Books&qid=1649704948&sr=8-275,150,4.5 out of 5 stars,872
377,SSC Multi Tasking Non Technical Guide 2022 Hindi,unknown,https://amazon.in/Multi-Tasking-Technical-Guide-Hindi/dp/9326191931/ref=sr_1_276?keywords=Books&qid=1649704948&sr=8-276,unkown,unknown,unknown
378,"If I can dream it, I can do it - Seeking inspiration from real life heroes",unknown,https://amazon.in/If-can-dream-Seeking-inspiration/dp/9353915813/ref=sr_1_277?keywords=Books&qid=1649704948&sr=8-277,unkown,unknown,unknown
379,Option Trading Se Paison Ka Ped Kaise Lagayen,unknown,https://amazon.in/Option-Trading-Paison-Kaise-Lagayen/dp/9390378931/ref=sr_1_278?keywords=Books&qid=1649704948&sr=8-278,unkown,unknown,unknown
380,World inbox Talati Book 2022 Gujarati with free paperset | Talati kam mantri book 2022 | talati book 2022 | gram panchayat secretary | talati paperset,unknown,https://amazon.in/Talati-Gujarati-paperset-panchayat-secretary/dp/B09RTLSCJZ/ref=sr_1_279?keywords=Books&qid=1649704948&sr=8-279,unkown,unknown,unknown
381,"One for All Olympiad PreviousYears’ Solved Papers, Class-4 Mathematics Book (For 2022 Exam)",Oswaal Editorial Board,https://amazon.in/Oswaal-Olympiad-Previous-Class-4-Mathematics/dp/9354235158/ref=sr_1_280?keywords=Books&qid=1649704948&sr=8-280,155,4.3 out of 5 stars,131
382,101 Witty Stories Of Akbar and Birbal - Collection Of Humorous Stories For Kids,Wonder House Books,https://amazon.in/101-Witty-Stories-Akbar-Birbal/dp/9390391709/ref=sr_1_281?keywords=Books&qid=1649704948&sr=8-281,339.32,4.6 out of 5 stars,699
383,"Oswaal CBSE Question Bank Chapterwise For Term 2, Class 10, Social Science (For 2022 Exam)",Oswaal Editorial Board,https://amazon.in/Oswaal-Question-Chapterwise-Social-Science/dp/9354636632/ref=sr_1_282?keywords=Books&qid=1649704948&sr=8-282,180,4.4 out of 5 stars,235
384,The Power of Your Subconscious Mind (Deluxe Hardbound Edition),unknown,https://amazon.in/gp/slredirect/picassoRedirect.html/ref=pa_sp_mtf_aps_sr_pg18_1?ie=UTF8&adId=A02943582FO81TMD9GVU4&url=%2FPower-Your-Subconscious-DELUXE-HARDBOUND%2Fdp%2F9389717345%2Fref%3Dsr_1_283_sspa%3Fkeywords%3DBooks%26qid%3D1649704948%26sr%3D8-283-spons%26psc%3D1&qualifier=1649704948&id=6685964609233241&widgetName=sp_mtf,unkown,unknown,unknown
385,Daily Inspiration For Everyday Men: A Collection of 365 Inspirational Quotes,unknown,https://amazon.in/gp/slredirect/picassoRedirect.html/ref=pa_sp_mtf_aps_sr_pg18_1?ie=UTF8&adId=A0470284289S82TQHQVEH&url=%2FDaily-Inspiration-Everyday-Men-Inspirational%2Fdp%2F9390183480%2Fref%3Dsr_1_284_sspa%3Fkeywords%3DBooks%26qid%3D1649704948%26sr%3D8-284-spons%26psc%3D1%26smid%3DA3H3WE9M6NY1KV&qualifier=1649704948&id=6685964609233241&widgetName=sp_mtf,unkown,unknown,unknown
386,Simplified Chalu Ghadamodi Diary 22 va Anka,unknown,https://amazon.in/Simplified-Chalu-Ghadamodi-Diary-Anka/dp/B09V2Z2GGB/ref=sr_1_285?keywords=Books&qid=1649704948&sr=8-285,unkown,unknown,unknown
387,DRISHTI PPS 6 BOOKS COMBO (ENGLISH),unknown,https://amazon.in/DRISHTI-PPS-BOOKS-COMBO-ENGLISH/dp/B09V532PL5/ref=sr_1_286?keywords=Books&qid=1649704948&sr=8-286,unkown,unknown,unknown
388,Frank EMU Books The Complete Cursive Handwriting Module 5 - Hello Mr. Pen - Cursive Writing Book for Kids Age 9 Years and Above With Fun Activities,unknown,https://amazon.in/Hello-Mr-Pen-Nil/dp/8173793980/ref=sr_1_287?keywords=Books&qid=1649704948&sr=8-287,unkown,unknown,unknown
389,All set to Read-A Phonic Reader-Level 1- PHONICS READERS- 6 books in a Box: Box set,Om Books Editorial Team,https://amazon.in/PHONIC-READER-LEVEL-1/dp/9384625760/ref=sr_1_288?keywords=Books&qid=1649704948&sr=8-288,540,4.5 out of 5 stars,"1,847"
390,Brain Boosting Activity Book for Kids – 200+ Activities for Age 3+,Maple Press,https://amazon.in/Brain-Boosting-Activity-Book-Kids/dp/9391129668/ref=sr_1_289?keywords=Books&qid=1649704948&sr=8-289,95,4.5 out of 5 stars,107
391,Arabic calligraphy practice book: Specially for thuluth font,unknown,https://amazon.in/Arabic-calligraphy-practice-book-Specially-ebook/dp/B08C737G3W/ref=sr_1_290?keywords=Books&qid=1649704948&sr=8-290,unkown,unknown,unknown
392,"Oswaal CBSE Sample Question Paper For Term 2, Class 10 Social Science Book (For 2022 Exam)",Oswaal Editorial Board,https://amazon.in/Oswaal-Sample-Question-Social-Science/dp/9354639054/ref=sr_1_291?keywords=Books&qid=1649704948&sr=8-291,127,4.7 out of 5 stars,42
393,Daksh Computer anudeshak/Instructor question bank,unknown,https://amazon.in/Daksh-Computer-anudeshak-Instructor-question/dp/B09X413PJX/ref=sr_1_292?keywords=Books&qid=1649704948&sr=8-292,unkown,unknown,unknown
394,The Power Of Influence,unknown,https://amazon.in/gp/slredirect/picassoRedirect.html/ref=pa_sp_btf_aps_sr_pg18_1?ie=UTF8&adId=A05254742XX1A7KCCCNH8&url=%2FPower-Influence-Yoritomo-Tashi%2Fdp%2F9389053765%2Fref%3Dsr_1_293_sspa%3Fkeywords%3DBooks%26qid%3D1649704948%26sr%3D8-293-spons%26psc%3D1%26smid%3DA3H3WE9M6NY1KV&qualifier=1649704948&id=6685964609233241&widgetName=sp_btf,unkown,unknown,unknown
395,"Industry 4.0 Interoperability, Analytics, Security, and Case Studies (Big Data for Industry 4.0)",unknown,https://amazon.in/gp/slredirect/picassoRedirect.html/ref=pa_sp_btf_aps_sr_pg18_1?ie=UTF8&adId=A001317330SR0RNK9HWVF&url=%2FIndustry-Interoperability-Analytics-Security-Studies-ebook%2Fdp%2FB08R19SCMV%2Fref%3Dsr_1_294_sspa%3Fkeywords%3DBooks%26qid%3D1649704948%26sr%3D8-294-spons%26psc%3D1&qualifier=1649704948&id=6685964609233241&widgetName=sp_btf,unkown,unknown,unknown
396,Value Investing: From Graham to Buffett and Beyond (Wiley Finance Book 396),Judd Kahn,https://amazon.in/gp/slredirect/picassoRedirect.html/ref=pa_sp_atf_next_aps_sr_pg19_1?ie=UTF8&adId=A10036103NOATS43E0GCW&url=%2FValue-Investing-Graham-Buffett-Finance-ebook%2Fdp%2FB08M5C79D9%2Fref%3Dsr_1_289_sspa%3Fkeywords%3DBooks%26qid%3D1649704951%26sr%3D8-289-spons%26psc%3D1&qualifier=1649704951&id=2252866166466814&widgetName=sp_atf_next,979,4.7 out of 5 stars,120
397,Everybody Writes: Your Go-To Guide to Creating Ridiculously Good Content,Ann Handley,https://amazon.in/gp/slredirect/picassoRedirect.html/ref=pa_sp_atf_next_aps_sr_pg19_1?ie=UTF8&adId=A02295711FG3ET0VX6675&url=%2FEverybody-Writes-Go-Creating-Ridiculously-ebook%2Fdp%2FB00LMB5P0G%2Fref%3Dsr_1_290_sspa%3Fkeywords%3DBooks%26qid%3D1649704951%26sr%3D8-290-spons%26psc%3D1&qualifier=1649704951&id=2252866166466814&widgetName=sp_atf_next,199,4.5 out of 5 stars,984
398,Word Search - Vocabulary Booster: Classic Word Puzzles For Everyone,Wonder House Books,https://amazon.in/Word-Search-Vocabulary-Booster-Everyone/dp/9389717272/ref=sr_1_291?keywords=Books&qid=1649704951&sr=8-291,99,4.4 out of 5 stars,45
399,Birthday Girl,Haruki Murakami,https://amazon.in/Birthday-Girl-Haruki-Murakami/dp/1787301257/ref=sr_1_292?keywords=Books&qid=1649704951&sr=8-292,125,4.3 out of 5 stars,"1,913"
400,Books That Changed History: From the Art of War to Anne Frank's Diary,DK,https://amazon.in/Books-That-Changed-History-Dk/dp/0241289335/ref=sr_1_293?keywords=Books&qid=1649704951&sr=8-293,"1,311",4.6 out of 5 stars,140
401,The Psychology of Money - Paishache Manasshastra (Marathi),unknown,https://amazon.in/Psychology-Money-Paishache-Manasshastra-Marathi/dp/8194870151/ref=sr_1_294?keywords=Books&qid=1649704951&sr=8-294,unkown,unknown,unknown
402,Under The Sea - Coloring and Sticker Activity Book (With 150+ Stickers) (Coloring Sticker Activity Books),Wonder House Books,https://amazon.in/Under-Sea-Coloring-Activity-Stickers/dp/9388810783/ref=sr_1_295?keywords=Books&qid=1649704951&sr=8-295,159,4.5 out of 5 stars,367
403,Harper Collins India Wipe n Clean Books - Pen Control,unknown,https://amazon.in/Wipe-Clean-Books-Pen-Control/dp/935357109X/ref=sr_1_296?keywords=Books&qid=1649704951&sr=8-296,unkown,unknown,unknown
404,The Little Book of Comfort (collection of comforting thoughts and words of wisdom with illustrations for motivation positivity peace and happiness by Ruskin Bond),unknown,https://amazon.in/Little-Book-Comfort-Bond-Ruskin/dp/0670092290/ref=sr_1_297?keywords=Books&qid=1649704951&sr=8-297,unkown,unknown,unknown
405,Color Me 2: For Those Who Love to Color and For Those Who Didn't Think They Could! Discover The Hidden Images as You Color!,unknown,https://amazon.in/Color-Me-Discover-Hidden-Images/dp/1467533947/ref=sr_1_298?keywords=Books&qid=1649704951&sr=8-298,unkown,unknown,unknown
406,Think and Grow Rich (Deluxe Hardbound Edition),Napoleon Hill,https://amazon.in/gp/slredirect/picassoRedirect.html/ref=pa_sp_mtf_aps_sr_pg19_1?ie=UTF8&adId=A02941141U0BCDHAZ2P72&url=%2FThink-Grow-Rich-DELUXE-HARDBOUND%2Fdp%2F9389717426%2Fref%3Dsr_1_299_sspa%3Fkeywords%3DBooks%26qid%3D1649704951%26sr%3D8-299-spons%26psc%3D1&qualifier=1649704951&id=2252866166466814&widgetName=sp_mtf,292,4.5 out of 5 stars,"64,498"
407,Brain Rules (Marathi),unknown,https://amazon.in/gp/slredirect/picassoRedirect.html/ref=pa_sp_mtf_aps_sr_pg19_1?ie=UTF8&adId=A02230793SVMY4JMKF7IW&url=%2FBrain-Rules-Marathi-John-Medina%2Fdp%2F935220106X%2Fref%3Dsr_1_300_sspa%3Fkeywords%3DBooks%26qid%3D1649704951%26sr%3D8-300-spons%26psc%3D1&qualifier=1649704951&id=2252866166466814&widgetName=sp_mtf,unkown,unknown,unknown
408,NCERT Textbooks in English for class 12 - Flamingo and Vistas - 12074 &12075,unknown,https://amazon.in/NCERT-Textbooks-English-class-12/dp/B08K4JM83V/ref=sr_1_301?keywords=Books&qid=1649704951&sr=8-301,unkown,unknown,unknown
409,World's Greatest Entrepreneurs: Biographies of Inspirational Personalities For Kids,Wonder House Books,https://amazon.in/Worlds-Greatest-Entrepreneurs-Inspirational-Personalities/dp/9388810376/ref=sr_1_302?keywords=Books&qid=1649704951&sr=8-302,99,4.4 out of 5 stars,"1,319"
410,Oswaal CBSE Term 2 Computer Science Class 12 Sample Question Papers Book (For Term-2 2022 Exam),Oswaal Editorial Board,https://amazon.in/Oswaal-Computer-Science-Sample-Question/dp/935463933X/ref=sr_1_303?keywords=Books&qid=1649704951&sr=8-303,79,4.9 out of 5 stars,24
411,"Dragon's Breath: (Children Books About Dragon, picture, preschool, ages 3 5, kids books) (Emotions & Feelings Book 1)",Michael Gordon,https://amazon.in/Dragons-Breath-Children-Books-Health-ebook/dp/B071YPJFJJ/ref=sr_1_304?keywords=Books&qid=1649704951&sr=8-304,68,4.4 out of 5 stars,"5,199"
412,"MHT CET Triumph Physics Book for Engineering and Pharmacy Entrance Exam | Based on relevant chapters of 11th and 12th Syllabus of Maharashtra Board | Includes Important Formulae, Shortcuts, MCQs [Paperback] Content Team at Target Publications [Paperback] Content Team at Target Publications",unknown,https://amazon.in/MHT-CET-Triumph-Physics-Based-Syllabus/dp/8193848144/ref=sr_1_305?keywords=Books&qid=1649704951&sr=8-305,unkown,unknown,unknown
413,Sahyadri 2022 - Police Bharti Sampoorna Margadarshak - Navin - Sudharit va Vistarit Avrutti,unknown,https://amazon.in/Sahyadri-2022-Sampoorna-Margadarshak-Sudharit/dp/B09PJHKTVW/ref=sr_1_306?keywords=Books&qid=1649704951&sr=8-306,unkown,unknown,unknown
414,"Hadbe 35,000+ Jumbo Mega Police Bharti - THE SMART BOOK - 2022/ 9th Ed. - 100+ Videos, 200+ Test Ranks and 100+ Sarav Including",unknown,https://amazon.in/Hadbe-Jumbo-Mega-Police-Bharti/dp/B09RH238TF/ref=sr_1_307?keywords=Books&qid=1649704951&sr=8-307,unkown,unknown,unknown
415,"Super Table Book with Mental Practice - Multiplication Table 1 -20,| Learn Numerical Concepts with Exercises for Practising Addition, Subtraction, Multiplication, Division",unknown,https://amazon.in/Super-Mental-Practice-Dreamland-Publications/dp/9350896095/ref=sr_1_308?keywords=Books&qid=1649704951&sr=8-308,unkown,unknown,unknown
416,Getting Started in Technical Analysis: 19,Jack D. Schwager,https://amazon.in/gp/slredirect/picassoRedirect.html/ref=pa_sp_btf_aps_sr_pg19_1?ie=UTF8&adId=A10083993OX952LWCRMK7&url=%2FGetting-Started-Technical-Analysis-Schwager%2Fdp%2F0471295426%2Fref%3Dsr_1_309_sspa%3Fkeywords%3DBooks%26qid%3D1649704951%26sr%3D8-309-spons%26psc%3D1&qualifier=1649704951&id=2252866166466814&widgetName=sp_btf,699,4.1 out of 5 stars,411
417,Tally.ERP 9 with GST in Simple Steps,DT Editorial Services,https://amazon.in/gp/slredirect/picassoRedirect.html/ref=pa_sp_btf_aps_sr_pg19_1?ie=UTF8&adId=A09629082LQRV7DIE7YXB&url=%2FTally-ERP-9-GST-Simple-Steps%2Fdp%2F9389872553%2Fref%3Dsr_1_310_sspa%3Fkeywords%3DBooks%26qid%3D1649704951%26sr%3D8-310-spons%26psc%3D1&qualifier=1649704951&id=2252866166466814&widgetName=sp_btf,380,3.9 out of 5 stars,95
418,All Marketers Tell Stories: The Underground Classic That Explains How Marketing Really Works--and Why Authenticity Is the Best Marketing of All,unknown,https://amazon.in/gp/slredirect/picassoRedirect.html/ref=pa_sp_atf_next_aps_sr_pg20_1?ie=UTF8&adId=A04723472TOA4XTKE3196&url=%2FAll-Marketers-Tell-Stories-Works%2Fdp%2FB09FZ5CCVQ%2Fref%3Dsr_1_305_sspa%3Fkeywords%3DBooks%26qid%3D1649704955%26sr%3D8-305-spons%26psc%3D1&qualifier=1649704955&id=3534076135307750&widgetName=sp_atf_next,unkown,unknown,unknown
