,Title,Author,Link,Price,Rating,Rating Count
86,Secrets of a Pivot Boss: Revealing Proven Methods for Profiting in the Market,unknown,https://amazon.in/gp/slredirect/picassoRedirect.html/ref=pa_sp_btf_aps_sr_pg4_1?ie=UTF8&adId=A1009267QL45DBPD8SLZ&url=%2FSecrets-Pivot-Boss-Revealing-Profiting%2Fdp%2F0615391273%2Fref%3Dsr_1_69_sspa%3Fkeywords%3DBooks%26qid%3D1649704902%26sr%3D8-69-spons%26psc%3D1&qualifier=1649704902&id=4052308288396768&widgetName=sp_btf,unkown,unknown,unknown
87,Fingerprint! Publishing The Best of Sherlock Holmes (Set of 2 Books),unknown,https://amazon.in/gp/slredirect/picassoRedirect.html/ref=pa_sp_btf_aps_sr_pg4_1?ie=UTF8&adId=A06567643THX9NO3CIUPO&url=%2FBest-Sherlock-Holmes-Set-Books%2Fdp%2F9388810538%2Fref%3Dsr_1_70_sspa%3Fkeywords%3DBooks%26qid%3D1649704902%26sr%3D8-70-spons%26psc%3D1&qualifier=1649704902&id=4052308288396768&widgetName=sp_btf,unkown,unknown,unknown
88,Animal Farm,George Orwell,https://amazon.in/gp/slredirect/picassoRedirect.html/ref=pa_sp_atf_next_aps_sr_pg5_1?ie=UTF8&adId=A06846391BJUOAV4OEPMX&url=%2FAnimal-Farm-George-Orwell%2Fdp%2F8172344392%2Fref%3Dsr_1_65_sspa%3Fkeywords%3DBooks%26qid%3D1649704905%26sr%3D8-65-spons%26psc%3D1&qualifier=1649704905&id=5637413117175412&widgetName=sp_atf_next,79,4.6 out of 5 stars,"33,542"
89,The Power of A Positive Attitude: Your Road To Success,Roger Fritz,https://amazon.in/gp/slredirect/picassoRedirect.html/ref=pa_sp_atf_next_aps_sr_pg5_1?ie=UTF8&adId=A03079692OYY3ZC13BXNX&url=%2FPower-Positive-Attitude-Your-Success%2Fdp%2F9389432642%2Fref%3Dsr_1_66_sspa%3Fkeywords%3DBooks%26qid%3D1649704905%26sr%3D8-66-spons%26psc%3D1&qualifier=1649704905&id=5637413117175412&widgetName=sp_atf_next,99,4.4 out of 5 stars,"1,703"
90,"Little Artist Copy Colouring Boxset: Pack of 8 Books (Birds, Sea Animals, Fruits, Vegetables, Dinosaurs, Cars and People Around Us): Set of 8 books ... Dinosaurs, Cars and People Around Us)",Wonder House Books,https://amazon.in/Little-Artist-Copy-Colouring-Pack/dp/938814404X/ref=sr_1_67?keywords=Books&qid=1649704905&sr=8-67,292,4.5 out of 5 stars,841
91,201 Sight Words And Sentence (With 800+ Sentences To Read): Activity Book For Children,unknown,https://amazon.in/Sight-Words-Sentence-Sentences-Read/dp/9354402798/ref=sr_1_68?keywords=Books&qid=1649704905&sr=8-68,unkown,unknown,unknown
92,ShrimadBhagavadGita Bhaag 1 / श्रीमद्भगवद्गीता भाग-१ By Acharya Prashant,unknown,https://amazon.in/ShrimadBhagavadGita-%E0%A4%B6%E0%A5%8D%E0%A4%B0%E0%A5%80%E0%A4%AE%E0%A4%A6%E0%A5%8D%E0%A4%AD%E0%A4%97%E0%A4%B5%E0%A4%A6%E0%A5%8D%E0%A4%97%E0%A5%80%E0%A4%A4%E0%A4%BE-%E0%A4%AD%E0%A4%BE%E0%A4%97-%E0%A5%A7-Acharya-Prashant/dp/9392657579/ref=sr_1_69?keywords=Books&qid=1649704905&sr=8-69,unkown,unknown,unknown
93,Picture Books Collection for Early Learning (Set of 12),unknown,https://amazon.in/Picture-Books-Collection-Early-Learning/dp/B01M0QGF0P/ref=sr_1_70?keywords=Books&qid=1649704905&sr=8-70,unkown,unknown,unknown
94,101 Sight Words And Sentence (With 400+ Sentences To Read): Activity Book For Children,unknown,https://amazon.in/Sight-Words-Sentence-Sentences-Read/dp/9354402879/ref=sr_1_71?keywords=Books&qid=1649704905&sr=8-71,unkown,unknown,unknown
95,Balasaheb Shinde - Sampoorna Engreji Vyakaran (English Vyakaran) - 3800+ Prashna - 12th. Ed./2022-23,unknown,https://amazon.in/Balasaheb-Shinde-Sampoorna-Engreji-Vyakaran/dp/B09VFF898F/ref=sr_1_72?keywords=Books&qid=1649704905&sr=8-72,unkown,unknown,unknown
96,Five On A Treasure Island: Book 1 (The Famous Five Series),Enid Blyton,https://amazon.in/Five-Treasure-Island-Famous/dp/0340894547/ref=sr_1_73?keywords=Books&qid=1649704905&sr=8-73,173,4.6 out of 5 stars,"2,356"
97,"The Secret Byrne, in 2007 has also featured in the Best Seller Book",Rhonda Byrne,https://amazon.in/Secret-Byrne-2007-featured-Seller/dp/B09FSX384K/ref=sr_1_74?keywords=Books&qid=1649704905&sr=8-74,225,4.6 out of 5 stars,"29,822"
98,World’s Greatest Books On Public Speaking (Box Set of 2 Books),Dale Carnegie,https://amazon.in/gp/slredirect/picassoRedirect.html/ref=pa_sp_mtf_aps_sr_pg5_1?ie=UTF8&adId=A0354849EH19HN9W2HKP&url=%2FWorlds-Greatest-Books-Public-Speaking%2Fdp%2F9354401651%2Fref%3Dsr_1_75_sspa%3Fkeywords%3DBooks%26qid%3D1649704905%26sr%3D8-75-spons%26psc%3D1%26smid%3DA3H3WE9M6NY1KV&qualifier=1649704905&id=5637413117175412&widgetName=sp_mtf,219,4.4 out of 5 stars,35
99,Until Love Sets Us Apart (Hindi),unknown,https://amazon.in/gp/slredirect/picassoRedirect.html/ref=pa_sp_mtf_aps_sr_pg5_1?ie=UTF8&adId=A01708592PC5H9ARD1XXU&url=%2FUntil-Love-Sets-Apart-Hindi%2Fdp%2F8194932327%2Fref%3Dsr_1_76_sspa%3Fkeywords%3DBooks%26qid%3D1649704905%26sr%3D8-76-spons%26psc%3D1%26smid%3DA3H3WE9M6NY1KV&qualifier=1649704905&id=5637413117175412&widgetName=sp_mtf,unkown,unknown,unknown
100,The Secret of the Chateau (The Kate Benedict Series Book 7),Carrie Bedford,https://amazon.in/Secret-Chateau-Kate-Benedict-Book-ebook/dp/B09QJV4P93/ref=sr_1_77?keywords=Books&qid=1649704905&sr=8-77,0,4.6 out of 5 stars,147
101,Abhinav Year Book 2022,unknown,https://amazon.in/Abhinav-Year-Book-Pradeep-Sanap/dp/B09PKFYX37/ref=sr_1_78?keywords=Books&qid=1649704905&sr=8-78,unkown,unknown,unknown
102,The Girl Who Drank the Moon,Kelly Barnhill,https://amazon.in/Girl-Who-Drank-Moon/dp/1848126476/ref=sr_1_79?keywords=Books&qid=1649704905&sr=8-79,290,4.5 out of 5 stars,"14,938"
103,Moral Story Books for Kids (Pack of 10 Books) | 160 Total Pages | Illustrated Stories,unknown,https://amazon.in/Moral-Story-Books-Illustrated-Stories/dp/9381569886/ref=sr_1_80?keywords=Books&qid=1649704905&sr=8-80,unkown,unknown,unknown
104,"QSHIXL Magic Practice Copybook, (4 BOOK + 10 REFILL ) Number Book for Preschoolers with Pen, Magic Calligraphy Copybook Set Reusable Writing Tool Simply Hand Lettering Stationery",unknown,https://amazon.in/Practice-Preschoolers-Calligraphy-Lettering-Stationery/dp/B09X47MTWK/ref=sr_1_81?keywords=Books&qid=1649704905&sr=8-81,unkown,unknown,unknown
105,Activity Book for Kids - Maths for Age 6+,unknown,https://amazon.in/Activity-Book-Kids-Maths-Age/dp/9391924611/ref=sr_1_82?keywords=Books&qid=1649704905&sr=8-82,unkown,unknown,unknown
106,World inbox Gram sevak book GPSSB Gramsevak krushi vigyan book Subject related krushi vishyak ane farjo Gramsevak book gujarati 2022,unknown,https://amazon.in/Gramsevak-Subject-related-vishyak-gujarati/dp/B09TQ3PBBZ/ref=sr_1_83?keywords=Books&qid=1649704905&sr=8-83,unkown,unknown,unknown
107,Grandparents' Bag of Stories,unknown,https://amazon.in/Grandparents-Bag-Stories-Sudha-Murty/dp/0143451847/ref=sr_1_84?keywords=Books&qid=1649704905&sr=8-84,unkown,unknown,unknown
108,"My Life in Full: Work, Family, and Our Future (With a special Epilogue for India)",unknown,https://amazon.in/gp/slredirect/picassoRedirect.html/ref=pa_sp_btf_aps_sr_pg5_1?ie=UTF8&adId=A07107872W0RO19LX0ZYO&url=%2FMy-Life-Full-special-Epilogue%2Fdp%2F9389253810%2Fref%3Dsr_1_85_sspa%3Fkeywords%3DBooks%26qid%3D1649704905%26sr%3D8-85-spons%26psc%3D1&qualifier=1649704905&id=5637413117175412&widgetName=sp_btf,unkown,unknown,unknown
109,Write A New Name In The Book Of Life: With Love Is Freedom & Wheels Of Truth,unknown,https://amazon.in/gp/slredirect/picassoRedirect.html/ref=pa_sp_btf_aps_sr_pg5_1?ie=UTF8&adId=A02174342YN960XZ7SO1G&url=%2FWrite-New-Name-Book-Life%2Fdp%2F9389717124%2Fref%3Dsr_1_86_sspa%3Fkeywords%3DBooks%26qid%3D1649704905%26sr%3D8-86-spons%26psc%3D1&qualifier=1649704905&id=5637413117175412&widgetName=sp_btf,unkown,unknown,unknown
110,The 10X Rule: The Only Difference Between Success and Failure,Grant Cardone,https://amazon.in/gp/slredirect/picassoRedirect.html/ref=pa_sp_atf_next_aps_sr_pg6_1?ie=UTF8&adId=A0229415270GNHL5SMPCH&url=%2F10X-Rule-Difference-Between-Success-ebook%2Fdp%2FB004X75OES%2Fref%3Dsr_1_81_sspa%3Fkeywords%3DBooks%26qid%3D1649704908%26sr%3D8-81-spons%26psc%3D1&qualifier=1649704908&id=1363086172898274&widgetName=sp_atf_next,137.75,4.5 out of 5 stars,"6,320"
111,Mahatma Gandhi Autobiography: The Story Of My Experiments With Truth,unknown,https://amazon.in/gp/slredirect/picassoRedirect.html/ref=pa_sp_atf_next_aps_sr_pg6_1?ie=UTF8&adId=A0459143WQ2PBHYQ7G8I&url=%2FMahatma-Gandhi-Autobiography-Story-Experiments%2Fdp%2F8172343116%2Fref%3Dsr_1_82_sspa%3Fkeywords%3DBooks%26qid%3D1649704908%26sr%3D8-82-spons%26psc%3D1&qualifier=1649704908&id=1363086172898274&widgetName=sp_atf_next,unkown,unknown,unknown
112,Rich Dad Poor Dad - 20Th Anniversary Edition - Hindi,Robert T. Kiyosaki,https://amazon.in/Rich-Dad-Poor-Robert-Kiyosaki/dp/8186775218/ref=sr_1_83?keywords=Books&qid=1649704908&sr=8-83,208,4.5 out of 5 stars,"10,287"
113,"Sank Magic Practice Copybook, (4 BOOK + 10 REFILL) Number Tracing Book for Preschoolers with Pen, Magic Calligraphy Copybook Set Practical Reusable Writing Tool Simply Hand Lettering",unknown,https://amazon.in/Practice-Preschoolers-Calligraphy-Practical-Lettering/dp/B09VCN8ZS8/ref=sr_1_84?keywords=Books&qid=1649704908&sr=8-84,unkown,unknown,unknown
114,Look Who's Hiding - Forest : Pull The Tab Novelty Books For Children,Wonder House Books,https://amazon.in/Look-Whos-Hiding-Novelty-Children/dp/9389432286/ref=sr_1_85?keywords=Books&qid=1649704908&sr=8-85,184,4.7 out of 5 stars,69
115,My First Board Book All In One Learning Book For Kids,unknown,https://amazon.in/First-Board-Book-Learning-Kids/dp/B08WLDZFL9/ref=sr_1_86?keywords=Books&qid=1649704908&sr=8-86,unkown,unknown,unknown
116,"ZQWD Magic Practice Copybook, (4 BOOK + 10 REFILL) Number Tracing Book for Preschoolers with Pen, Magic Calligraphy Copybook Set Practical Reusable Writing Tool Simple Hand Lettering (19*13 CM)",unknown,https://amazon.in/Practice-Preschoolers-Calligraphy-Practical-Lettering/dp/B09P66SGQN/ref=sr_1_87?keywords=Books&qid=1649704908&sr=8-87,unkown,unknown,unknown
117,"Phonics Reader 5 Books Pack for Children Age 3 -10 Years -Alphabet Sounds, A to Z, Short and Long Vowel Sounds, Word Families Short and Long Vowel Sounds, Blends and Combination Sounds, Tricky Words",Dreamland Publications,https://amazon.in/Phonics-Children-Alphabet-Families-Combination/dp/9389281393/ref=sr_1_88?keywords=Books&qid=1649704908&sr=8-88,649,4.5 out of 5 stars,216
118,My First Experiences Sticker Book,Wonder House Books,https://amazon.in/My-First-Experiences-Sticker-Book/dp/9388369815/ref=sr_1_89?keywords=Books&qid=1649704908&sr=8-89,129,4.2 out of 5 stars,573
119,As a Man Thinketh,James Allen,https://amazon.in/As-Man-Thinketh-James-Allen/dp/9386538172/ref=sr_1_90?keywords=Books&qid=1649704908&sr=8-90,69,4.4 out of 5 stars,"7,651"
120,The Science of Getting Rich with The Science of Being Great,unknown,https://amazon.in/gp/slredirect/picassoRedirect.html/ref=pa_sp_mtf_aps_sr_pg6_1?ie=UTF8&adId=A0885804U9Y9LD60HBWW&url=%2FScience-Getting-Rich-Being-Great%2Fdp%2F9389432928%2Fref%3Dsr_1_91_sspa%3Fkeywords%3DBooks%26qid%3D1649704908%26sr%3D8-91-spons%26psc%3D1&qualifier=1649704908&id=1363086172898274&widgetName=sp_mtf,unkown,unknown,unknown
121,The Little Prince,unknown,https://amazon.in/gp/slredirect/picassoRedirect.html/ref=pa_sp_mtf_aps_sr_pg6_1?ie=UTF8&adId=A01775151CX7HBLGTK1HX&url=%2FLittle-Prince-Antoine-Saint-Exup%25C3%25A9ry%2Fdp%2F817599357X%2Fref%3Dsr_1_92_sspa%3Fkeywords%3DBooks%26qid%3D1649704908%26sr%3D8-92-spons%26psc%3D1&qualifier=1649704908&id=1363086172898274&widgetName=sp_mtf,unkown,unknown,unknown
122,Sunderkand (Series Book 5) (Hindi Edition),Goswami Tulsidas,https://amazon.in/Sunderkand-Book-Hindi-Goswami-Tulsidas-ebook/dp/B07HD52R95/ref=sr_1_93?keywords=Books&qid=1649704908&sr=8-93,49,4.7 out of 5 stars,"1,813"
123,"Masala Lab: The Science of Indian Cooking: The Science of Indian Cooking - the bestseller on food, the definitive book for every Indian kitchen, illustrated",Krish Ashok,https://amazon.in/Masala-Lab-Science-Indian-Cooking/dp/0143451375/ref=sr_1_94?keywords=Books&qid=1649704908&sr=8-94,262,4.5 out of 5 stars,"1,562"
124,Shri Rama Koti BIG/LARGE Size [Laksha naamaalu] 1book by Saibhadrakali [Paperback] Saibhadrakali,unknown,https://amazon.in/LARGE-Laksha-naamaalu-1book-Saibhadrakali/dp/B08PZD4Q2B/ref=sr_1_95?keywords=Books&qid=1649704908&sr=8-95,unkown,unknown,unknown
125,How to Make Money Trading with Candlestick Charts,Balkrishna M Sadekar,https://amazon.in/Make-Money-Trading-Candlestick-Charts/dp/8170948126/ref=sr_1_96?keywords=Books&qid=1649704908&sr=8-96,399,4.3 out of 5 stars,"2,301"
126,The Illustrated Moral Tales: Classic Tales from India,Wonder House Books,https://amazon.in/Illustrated-Moral-Tales-Classic-India/dp/9389717035/ref=sr_1_97?keywords=Books&qid=1649704908&sr=8-97,169,4.6 out of 5 stars,170
127,Arthashastra,Kautilya,https://amazon.in/Arthashastra-Kautilya/dp/9354403700/ref=sr_1_98?keywords=Books&qid=1649704908&sr=8-98,229,4.4 out of 5 stars,75
128,"Avedia Sank Magic Practice Copy book For Kids Magic Book Calligraphy Pen, homeschool supplies, Numbers &English &Drawing &Mathematics Auto Fade Pen& 4Books 8 Riffile 1 Grip 1 Cover (small)",unknown,https://amazon.in/Practice-Calligraphy-homeschool-supplies-Mathematics/dp/B09R1MBTZK/ref=sr_1_99?keywords=Books&qid=1649704908&sr=8-99,unkown,unknown,unknown
129,Wordsearch Challenge book 1: 200 themed wordsearch puzzles (Collins Wordsearches),Collins Puzzles,https://amazon.in/Wordsearch-Challenge-book-wordsearch-puzzles/dp/0008279659/ref=sr_1_100?keywords=Books&qid=1649704908&sr=8-100,236,4.6 out of 5 stars,533
130,World’s Greatest Books For Personal Growth & Wealth (Set of 4 Books): Perfect Motivational Gift Set,unknown,https://amazon.in/gp/slredirect/picassoRedirect.html/ref=pa_sp_btf_aps_sr_pg6_1?ie=UTF8&adId=A10239661C8CJHMGI2PI7&url=%2FWorlds-Greatest-Personal-Growth-Wealth%2Fdp%2F9389432014%2Fref%3Dsr_1_101_sspa%3Fkeywords%3DBooks%26qid%3D1649704908%26sr%3D8-101-spons%26psc%3D1&qualifier=1649704908&id=1363086172898274&widgetName=sp_btf,unkown,unknown,unknown
131,Nationalism,Rabindranath Tagore,https://amazon.in/gp/slredirect/picassoRedirect.html/ref=pa_sp_btf_aps_sr_pg6_1?ie=UTF8&adId=A085579313B7831I2P4ZD&url=%2FNationalism-Rabindranath-Tagore%2Fdp%2F8175993103%2Fref%3Dsr_1_102_sspa%3Fkeywords%3DBooks%26qid%3D1649704908%26sr%3D8-102-spons%26psc%3D1&qualifier=1649704908&id=1363086172898274&widgetName=sp_btf,79,4.5 out of 5 stars,"5,474"
132,The Diary of a Young Girl,Anne Frank,https://amazon.in/gp/slredirect/picassoRedirect.html/ref=pa_sp_atf_next_aps_sr_pg7_1?ie=UTF8&adId=A039783724QM479WXZPP6&url=%2FDiary-Young-Girl-Anne-Frank%2Fdp%2F8193387600%2Fref%3Dsr_1_97_sspa%3Fkeywords%3DBooks%26qid%3D1649704911%26sr%3D8-97-spons%26psc%3D1%26smid%3DAPLYOO3IHSCW0&qualifier=1649704911&id=3160285764978880&widgetName=sp_atf_next,113,4.6 out of 5 stars,"17,025"
133,Advanced Product Quality Planning: The Road to Success (Practical Quality of the Future),D. H. Stamatis,https://amazon.in/gp/slredirect/picassoRedirect.html/ref=pa_sp_atf_next_aps_sr_pg7_1?ie=UTF8&adId=A07489301X5C1CIUS45B4&url=%2FAdvanced-Product-Quality-Planning-Practical%2Fdp%2F1138394580%2Fref%3Dsr_1_98_sspa%3Fkeywords%3DBooks%26qid%3D1649704911%26sr%3D8-98-spons%26psc%3D1&qualifier=1649704911&id=3160285764978880&widgetName=sp_atf_next,"2,395",4.0 out of 5 stars,5
134,My First Complete Learning Library: Boxset of 20 Board Books Gift Set for Kids (Horizontal Design): Box Set of 20 Board Books for Children,Wonder House Books,https://amazon.in/First-Learning-Library-Box-Set/dp/9388369882/ref=sr_1_99?keywords=Books&qid=1649704911&sr=8-99,769,4.6 out of 5 stars,"9,280"
135,The Quick and Easy Way to Effective Speaking,Dale Carnegie,https://amazon.in/Quick-Easy-Way-Effective-Speaking/dp/8129140209/ref=sr_1_100?keywords=Books&qid=1649704911&sr=8-100,98,4.2 out of 5 stars,"2,853"
136,My First Shapes and Colours Sticker Book: Exciting Sticker Book With 100 Stickers,Wonder House Books,https://amazon.in/First-Shapes-Colours-Sticker-Book/dp/938814497X/ref=sr_1_101?keywords=Books&qid=1649704911&sr=8-101,150,4.5 out of 5 stars,841
137,101 Good Night Stories,unknown,https://amazon.in/Good-Night-Stories-Books-Editorial/dp/9353765536/ref=sr_1_102?keywords=Books&qid=1649704911&sr=8-102,unkown,unknown,unknown
138,My First Pop-Up Fairy Tales - Three Little Pigs : Pop up Books for children,unknown,https://amazon.in/My-First-Pop-Up-Fairy-Tales/dp/9354400124/ref=sr_1_103?keywords=Books&qid=1649704911&sr=8-103,unkown,unknown,unknown
139,365 Colouring Book for Kids - Painting and Drawing Book with 368 Big Pictures,Dreamland Publications,https://amazon.in/365-Colouring-Book-Dreamland-Publications/dp/9350895668/ref=sr_1_104?keywords=Books&qid=1649704911&sr=8-104,243,4.6 out of 5 stars,"4,519"
140,Encyclopedia: Amazing Questions & Answers Science,Om Books Editorial Team,https://amazon.in/Amazing-Question-Answers-Science-Editorial/dp/9352763068/ref=sr_1_105?keywords=Books&qid=1649704911&sr=8-105,143,4.5 out of 5 stars,"1,617"
141,101 Maze Activity Book: Fun Activity Book For Children,unknown,https://amazon.in/101-Maze-Activity-Book-Children/dp/9388369947/ref=sr_1_106?keywords=Books&qid=1649704911&sr=8-106,unkown,unknown,unknown
142,CyRM: Mastering the Management of Cybersecurity (Internal Audit and IT Audit),unknown,https://amazon.in/gp/slredirect/picassoRedirect.html/ref=pa_sp_mtf_aps_sr_pg7_1?ie=UTF8&adId=A01199451M71QII6EXJKU&url=%2FCyRM-Mastering-Management-Cybersecurity-Internal%2Fdp%2F0367565315%2Fref%3Dsr_1_107_sspa%3Fkeywords%3DBooks%26qid%3D1649704911%26sr%3D8-107-spons%26psc%3D1&qualifier=1649704911&id=3160285764978880&widgetName=sp_mtf,unkown,unknown,unknown
143,"SELL LIKE CRAZY: How to Get As Many Clients, Customers and Sales As You Can Possibly Handle",Sabri Suby,https://amazon.in/gp/slredirect/picassoRedirect.html/ref=pa_sp_mtf_aps_sr_pg7_1?ie=UTF8&adId=A1008955930YXA4A8H39&url=%2FSELL-LIKE-CRAZY-Customers-Possibly%2Fdp%2F064845990X%2Fref%3Dsr_1_108_sspa%3Fkeywords%3DBooks%26qid%3D1649704911%26sr%3D8-108-spons%26psc%3D1%26smid%3DA25HG80Z9W4NRH&qualifier=1649704911&id=3160285764978880&widgetName=sp_mtf,445,4.6 out of 5 stars,"1,331"
144,The Great Hunt: Book 2 of the Wheel of Time (Now a major TV series),Robert Jordan,https://amazon.in/Great-Hunt-Book-Wheel-Time-ebook/dp/B003CUDP16/ref=sr_1_109?keywords=Books&qid=1649704911&sr=8-109,175.23,4.7 out of 5 stars,"8,091"
145,Kiran CTET Baal Vikas and Shiksha Shastra Text Book Approach to Child Development & Pedagogy By Himanshi Singh(Hindi Medium)(3467),unknown,https://amazon.in/Shiksha-Approach-Development-Pedagogy-Himanshi/dp/9391533779/ref=sr_1_110?keywords=Books&qid=1649704911&sr=8-110,unkown,unknown,unknown
146,MD BOOK STORE Physics Part1 And Part2 Textbook for Class - 12 Combo Pack (NCERT),unknown,https://amazon.in/STORE-Physics-Part1-Part2-Textbook/dp/B08CXZ6D6Q/ref=sr_1_111?keywords=Books&qid=1649704911&sr=8-111,unkown,unknown,unknown
147,Big Picture Board Book ABC | Can Be Wiped Clean,unknown,https://amazon.in/Picture-Board-Book-Wiped-Clean/dp/B0999QMB8D/ref=sr_1_112?keywords=Books&qid=1649704911&sr=8-112,unkown,unknown,unknown
148,Apke Avchetan Man Ki Shakti (The Power of your Subconscious Mind in Hindi),Joseph Murphy,https://amazon.in/Avchetan-Shakti-Power-Subconscious-Hindi/dp/8175993669/ref=sr_1_113?keywords=Books&qid=1649704911&sr=8-113,99,4.4 out of 5 stars,"9,261"
149,My Magical Unicorn Sticker and Activity Book for Children Age 3 - 8 Years - With Bright Stickers to Decorate,Dreamland Publications,https://amazon.in/Magical-Unicorn-Sticker-Activity-Children/dp/9386671646/ref=sr_1_114?keywords=Books&qid=1649704911&sr=8-114,123,4.4 out of 5 stars,46
150,"Warren Buffett Yanche Guntavanuk Mantra Book; Investment Books in Marathi, वॉरन बफे मराठी पुस्तक, वॉरेन बफे बुक",unknown,https://amazon.in/Warren-Buffett-Guntavanuk-Investment-Marathi/dp/9352203429/ref=sr_1_115?keywords=Books&qid=1649704911&sr=8-115,unkown,unknown,unknown
151,Gramsevak Exam (Latest Edition) Latest 2022 Editon,unknown,https://amazon.in/Gramsevak-Exam-Latest-Rushi-Chalaliya/dp/938552027X/ref=sr_1_116?keywords=Books&qid=1649704911&sr=8-116,unkown,unknown,unknown
152,"I Am Invincible, Thirteen True Tales of Courage, Grit, & Survival",Neelam Kumar,https://amazon.in/gp/slredirect/picassoRedirect.html/ref=pa_sp_btf_aps_sr_pg7_1?ie=UTF8&adId=A04793833BS9SX94P20SC&url=%2FInvincible-Thirteen-Tales-Courage-Survival%2Fdp%2F8194899141%2Fref%3Dsr_1_117_sspa%3Fkeywords%3DBooks%26qid%3D1649704911%26sr%3D8-117-spons%26psc%3D1&qualifier=1649704911&id=3160285764978880&widgetName=sp_btf,219,4.6 out of 5 stars,56
153,"Lean for the Process Industries: Dealing with Complexity, Second Edition",Peter L. King,https://amazon.in/gp/slredirect/picassoRedirect.html/ref=pa_sp_btf_aps_sr_pg7_1?ie=UTF8&adId=A07490303DJAN66KU5B3V&url=%2FLean-Process-Industries-Dealing-Complexity%2Fdp%2F0367023326%2Fref%3Dsr_1_118_sspa%3Fkeywords%3DBooks%26qid%3D1649704911%26sr%3D8-118-spons%26psc%3D1&qualifier=1649704911&id=3160285764978880&widgetName=sp_btf,"3,085",5.0 out of 5 stars,1
154,The The Cybersecurity Self-Help Guide,unknown,https://amazon.in/gp/slredirect/picassoRedirect.html/ref=pa_sp_atf_next_aps_sr_pg8_1?ie=UTF8&adId=A01201012O3M13PULAI9G&url=%2FCybersecurity-Self-Help-Guide-Arun-Soni%2Fdp%2F0367709538%2Fref%3Dsr_1_113_sspa%3Fkeywords%3DBooks%26qid%3D1649704913%26sr%3D8-113-spons%26psc%3D1&qualifier=1649704913&id=161870390962596&widgetName=sp_atf_next,unkown,unknown,unknown
155,The Option Trader Handbook: Strategies and Trade Adjustments (Wiley Trading Book 440),George Jabbour,https://amazon.in/gp/slredirect/picassoRedirect.html/ref=pa_sp_atf_next_aps_sr_pg8_1?ie=UTF8&adId=A1027942NC8HF26NTAI7&url=%2FOption-Trader-Handbook-Strategies-Adjustments-ebook%2Fdp%2FB0032CVB7O%2Fref%3Dsr_1_114_sspa%3Fkeywords%3DBooks%26qid%3D1649704913%26sr%3D8-114-spons%26psc%3D1&qualifier=1649704913&id=161870390962596&widgetName=sp_atf_next,"3,838",4.6 out of 5 stars,35
156,आजी-आजोबांनी सांगितलेल्या 121 गोष्टी | Aaji-Aajombani Saangitlelya 121 Goshti Story Book By Sawan | Hardbound In Marathi,unknown,https://amazon.in/%E0%A4%86%E0%A4%9C%E0%A5%80-%E0%A4%86%E0%A4%9C%E0%A5%8B%E0%A4%AC%E0%A4%BE%E0%A4%82%E0%A4%A8%E0%A5%80-%E0%A4%B8%E0%A4%BE%E0%A4%82%E0%A4%97%E0%A4%BF%E0%A4%A4%E0%A4%B2%E0%A5%87%E0%A4%B2%E0%A5%8D%E0%A4%AF%E0%A4%BE-Aaji-Aajombani-Saangitlelya-Hardbound/dp/B08N6ZM1LN/ref=sr_1_115?keywords=Books&qid=1649704913&sr=8-115,unkown,unknown,unknown
157,"CSIR NET/JRF Life Sciences MCQ Practice book, Thirteenth Edition",unknown,https://amazon.in/CSIR-Life-Sciences-Practice-Thirteenth/dp/819497447X/ref=sr_1_116?keywords=Books&qid=1649704913&sr=8-116,unkown,unknown,unknown
158,Very First Sight Words Sentences Level 1,Dreamland Publications,https://amazon.in/First-Sight-Words-Sentences-Level/dp/9387971996/ref=sr_1_117?keywords=Books&qid=1649704913&sr=8-117,170,4.5 out of 5 stars,"9,175"
159,Introductory Macroeconomics CBSE Class 12 Book (For 2023 Exam),unknown,https://amazon.in/Introductory-Macroeconomics-CBSE-Class-Book/dp/9356120404/ref=sr_1_118?keywords=Books&qid=1649704913&sr=8-118,unkown,unknown,unknown
160,"My Little Book of Krishna: Illustrated board books on Hindu mythology, Indian gods & goddesses for kids age 3+; A Puffin Original.",Ashwitha Jayakumar,https://amazon.in/Little-Book-Krishna-Illustrated-mythology/dp/0143453246/ref=sr_1_119?keywords=Books&qid=1649704913&sr=8-119,123,4.7 out of 5 stars,159
161,The Secret Seven Collection 1: Books 1-3 (Secret Seven Collections and Gift books),Enid Blyton,https://amazon.in/Secret-Seven-Collection-Books-Collections-ebook/dp/B07SPM1M6Y/ref=sr_1_120?keywords=Books&qid=1649704913&sr=8-120,227.15,4.6 out of 5 stars,809
162,9 Year Wise UPSC Civil Services IAS Mains English (Compulsory) Solved Papers (2013 - 2022) 3rd Edition,unknown,https://amazon.in/Services-English-Compulsory-Solved-Papers/dp/9355640765/ref=sr_1_121?keywords=Books&qid=1649704913&sr=8-121,unkown,unknown,unknown
163,Shreeman Yogi,Ranjeet Desai,https://amazon.in/Shreeman-Yogi-Marathi-Ranjeet-Desai/dp/B07MMDNNLJ/ref=sr_1_122?keywords=Books&qid=1649704913&sr=8-122,399,4.8 out of 5 stars,"1,935"
164,The Laws of the Spirit World,Khorshed Bhavnagri,https://amazon.in/gp/slredirect/picassoRedirect.html/ref=pa_sp_mtf_aps_sr_pg8_1?ie=UTF8&adId=A05972671SKL4SKQ8A3HI&url=%2FLaws-Spirit-World-Khorshed-Bhavnagri%2Fdp%2F817992985X%2Fref%3Dsr_1_123_sspa%3Fkeywords%3DBooks%26qid%3D1649704913%26sr%3D8-123-spons%26psc%3D1&qualifier=1649704913&id=161870390962596&widgetName=sp_mtf,275,4.5 out of 5 stars,"1,644"
165,15 Sure-Shot Ways To Hit The Jackpot,unknown,https://amazon.in/gp/slredirect/picassoRedirect.html/ref=pa_sp_mtf_aps_sr_pg8_1?ie=UTF8&adId=A03603652LWI3L5LLCQUU&url=%2F15-Sure-Shot-Ways-Hit-Jackpot%2Fdp%2F9354403549%2Fref%3Dsr_1_124_sspa%3Fkeywords%3DBooks%26qid%3D1649704913%26sr%3D8-124-spons%26psc%3D1&qualifier=1649704913&id=161870390962596&widgetName=sp_mtf,unkown,unknown,unknown
166,Malgudi Adventures: Classic Tales for Children,unknown,https://amazon.in/Malgudi-Adventures-Narayan-R-K/dp/0143335901/ref=sr_1_125?keywords=Books&qid=1649704913&sr=8-125,unkown,unknown,unknown
167,The Psychology Book: Big Ideas Simply Explained,DK,https://amazon.in/Psychology-Book-Big-Ideas/dp/1405391243/ref=sr_1_126?keywords=Books&qid=1649704913&sr=8-126,861,4.5 out of 5 stars,"2,908"
168,MAH CET LLB 3 Years Exam Prep Book 2022 | 1500+ Solved Objective Questions For MHT CET (8 Full-length Mock Test + 8 Sectional Tests),EduGorilla Prep Experts,https://amazon.in/Maharashtra-Common-Entrance-Test-Year/dp/9390893399/ref=sr_1_127?keywords=Books&qid=1649704913&sr=8-127,325,4.2 out of 5 stars,202
169,"Edsmart English Writing Books- three letter word and Sentence Writing Practice Book, Fun and Educational 4 Line Handwriting Practice books for Kids for 4-7 years | Word Writing Book Set with Worksheets for CBSE",unknown,https://amazon.in/Sentence-Practice-Educational-Handwriting-Worksheets/dp/B09GP9KP5C/ref=sr_1_128?keywords=Books&qid=1649704913&sr=8-128,unkown,unknown,unknown
